{
  "schema_kind": "odd_domain.trace_record",
  "schema_version": "v1",
  "trace_id": "odd_domain.trace.apra_liquidity.reporting_position.apra_liquidity_position_001.agreement_treatment_basis.trade_agreement.v1",
  "source_ref": "review://parsed_trade_observation.json",
  "source_kind": "data",
  "claim_key": "agreement_treatment_basis",
  "locator": "agreement",
  "observation_kind": "composed",
  "observed_at": "2026-04-15T00:10:00Z",
  "observed_value": {
    "type": "ISDA",
    "date": null,
    "version": null
  },
  "object_ref": "odd_domain.markov_object.apra_liquidity.reporting_position.apra_liquidity_position_001",
  "summary": "Imported trade agreement reference used to ground the reviewed master-agreement treatment basis."
}
